{
  "id": "2026-1-28",
  "type": "news_monitor",
  "date": "2026-1-28",
  "summary": "Welcome to the Daily News Channel, I'm Joe. In the past 24 hours, the global security landscape has once again become volatile: Europe, while strengthening its satellite communications and defense autonomy, faces subtle shifts in the relationship between NATO and the United States; the United States has conducted military exercises and operations in the Middle East and Latin America, while simultaneously reducing humanitarian aid to the United Nations; in Asia, India and the European Union have deepened their economic and security cooperation, and India and Russia plan joint naval exercises in the Bay of Bengal; and in the Arctic, the dispute over Greenland has reignited geopolitical tensions. In addition, the Russia-Ukraine conflict, the Syrian war, and terrorist attacks continue. Today, we will quickly summarize the background and context of these important events.",
  "topic": "Latest global political and military news",
  "rawMarkdown": "# Chief Intelligence Officer - Daily Brief\n**Topic**: Latest global political and military news\n**Time**: 2026/1/28 16:56\n\n## Situation Overview\nWelcome to the Daily News Channel, I'm Joe. In the past 24 hours, the global security landscape has once again become volatile: Europe, while strengthening its satellite communications and defense autonomy, faces subtle shifts in the relationship between NATO and the United States; the United States has conducted military exercises and operations in the Middle East and Latin America, while simultaneously reducing humanitarian aid to the United Nations; in Asia, India and the European Union have deepened their economic and security cooperation, and India and Russia plan joint naval exercises in the Bay of Bengal; and in the Arctic, the dispute over Greenland has reignited geopolitical tensions. In addition, the Russia-Ukraine conflict, the Syrian war, and terrorist attacks continue. Today, we will quickly summarize the background and context of these important events.\n\n## Key Intelligence\n### The EU advances its secure satellite communications plan, with GOVSATCOM and IRIS² officially launched.\n- **Time**: 2026-01-27\n- **Source**: Daily News – European Commission\n- **Summary**: According to the European Commission's daily press release, the EU announced today the launch of two key satellite projects: GOVSATCOM, providing secure government and military satellite links for all member states, and IRIS², which is scheduled to begin service in 2029. Both projects aim to reduce reliance on non-EU suppliers, enhance strategic autonomy, and build the EU's own secure connectivity network within the next decade.\n- **References**:\n  - [1] Daily News – European Commission: https://ec.europa.eu/commission/presscorner/detail/en/mex_26_245\n\n### The Greenland controversy highlights Europe's security dilemma\n- **Time**: 2026-01-27\n- **Source**: Vision Times\n- **Summary**: According to the Global Times, the recent renewed interest from the United States in Greenland has sparked concerns within the European Union about its northern defenses. Analysts point out that without deep transatlantic coordination, Europe will struggle to independently defend its Arctic frontiers, and this dispute further exposes the EU's shortcomings in strategic resources and defense autonomy.\n- **References**:\n  - [1] Vision Times: https://www.visiontimes.com/2026/01/27/greenland-controversy-highlights-europes-security-dilemma.html\n\n### NATO Secretary General attends European Parliament Security and Defence Committee meeting, calls for accelerated defense spending.\n- **Time**: 2026-01-27\n- **Source**: Eurasia Review\n- **Summary**: According to Eurasia Review, NATO Secretary General Mark Rutte addressed the European Parliament's External Affairs Committee (AFET) and Security and Defence Committee (SEDE) in Brussels today. He emphasized that in the face of the continued threats from Russia and China, member states must increase their defense budgets, continue to support Ukraine, and strengthen NATO and EU interoperability.\n- **References**:\n  - [1] Eurasia Review: https://www.eurasiareview.com/27012026-nato-secretary-general-attends-meeting-of-european-parliaments-committee-on-security-and-defence/\n\n### The EU-India summit signed a free trade and defense cooperation agreement.\n- **Time**: 2026-01-27\n- **Source**: The Star (Malaysia)\n- **Summary**: According to Malaysia's *The Star*, the 16th India-EU Summit concluded in New Delhi, with the two sides signing several agreements, including a free trade agreement, and reaching a memorandum of understanding on defense cooperation. The agreements cover joint naval exercises, cyber threat countermeasures, and space security dialogue, marking a further deepening of the strategic partnership between the two major economies amidst global instability.\n- **References**:\n  - [1] The Star (Malaysia): https://www.thestar.com.my/aseanplus/aseanplus-news/2026/01/27/india-and-eu-seek-economic-security-in-turbulent-times\n\n### Poland expands its military, becoming the largest army in the EU.\n- **Time**: 2026-01-27\n- **Source**: The Washington Post\n- **Summary**: According to The Washington Post, the Polish government announced today a significant expansion of its armed forces, planning to increase the size of its combat troops to nearly 300,000, making it the largest standing army within the European Union. This move is seen as a key step in deterring Russia's hybrid warfare capabilities and also reflects Poland's self-positioning in the regional security landscape.\n- **References**:\n  - [1] The Washington Post: https://www.washingtonpost.com/world/2026/01/27/poland-military-europe-hybrid-threats/\n\n### Bureaucracy may cause the British Royal Navy to lag behind China.\n- **Time**: 2026-01-27\n- **Source**: The Telegraph\n- **Summary**: According to The Daily Telegraph, British defense experts have warned that cumbersome approval processes are slowing down the development of the Royal Navy's next generation of warships. Without expedited decision-making, the British naval force may face a significant capability gap in competition with China's modern fleet.\n- **References**:\n  - [1] The Telegraph: https://www.telegraph.co.uk/news/2026/01/27/red-tape-could-sink-navys-ability-to-keep-up-with-china/\n\n### Trump reiterates sovereignty claim over Greenland\n- **Time**: 2026-01-28\n- **Source**: Philstar\n- **Summary**: According to a commentary in the Philippine Star, former US President Trump's renewed public claim to sovereignty over Greenland has sparked a new round of diplomatic tensions among European allies and prompted NATO to reassess its defense posture in the Arctic region.\n- **References**:\n  - [1] Philstar: https://www.philstar.com/opinion/2026/01/28/2503929/why-trump-insists-getting-greenland\n\n### Senior New Zealand defense officials inspect \"Thunder Warriors\" exercise\n- **Time**: 2026-01-28\n- **Source**: Indiplomacy\n- **Summary**: According to Indiplomacy, New Zealand's Senior Minister of Defence inspected the \"Thunder Warrior\" joint exercise this week at the Waioru Military Training Area. The exercise, which involves the New Zealand Defence Force and Singapore Special Forces, aims to enhance regional security cooperation and rapid response capabilities.\n- **References**:\n  - [1] Indiplomacy: https://indiplomacy.com/2026/01/28/senior-minister-of-state-for-defence-visits-saf-troops-at-exercise-thunder-warrior-in-new-zealand/\n\n### A suicide bombing at a Chinese restaurant in Kabul killed seven people.\n- **Time**: 2026-01-27\n- **Source**: Reuters (via Wikipedia portal)\n- **Summary**: According to a Reuters report relayed via Wikipedia's current events page, a suicide bombing at a Chinese restaurant in Kabul's New Nawa district on January 27, 2026, killed seven civilians and injured more than twenty. The Islamic State's Khugus group claimed responsibility for the attack, highlighting the ongoing conflict between terrorist groups and the Taliban in Afghanistan.\n- **References**:\n  - [1] Reuters (via Wikipedia portal): https://en.wikipedia.org/wiki/Portal:Current_events/January_2026\n\n### Somalia terminates all port agreements with the UAE\n- **Time**: 2026-01-27\n- **Source**: Middle East Eye / Dawan Africa / The New Arab\n- **Summary**: According to reports from multiple media outlets, including Middle East Eye, the Somali government cabinet announced today the termination of all cooperation agreements with the United Arab Emirates in the three major ports of Bereira, Bosavo, and Kismayo, accusing the UAE of supporting the Serlan region in northern Somalia. This move was immediately met with opposition from the local governments of Serlan, Bantusa, and Jubaran.\n- **References**:\n  - [1] Middle East Eye / Dawan Africa / The New Arab: https://en.wikipedia.org/wiki/Portal:Current_events/January_2026\n\n### Fierce fighting escalates in Kurdish region; Syrian forces capture Ain Issa and Salin.\n- **Time**: 2026-01-27\n- **Source**: Al Jazeera, The Guardian, ANHA, Reuters\n- **Summary**: According to multiple international media reports, despite a ceasefire announced the previous day, Syrian government forces launched an offensive today in northern Kurdistan, capturing the towns of Ain Issa and Salim, and raiding the Al-Shadah prison, resulting in the escape of several ISIS fighters. The conflict has exacerbated the humanitarian crisis in the region.\n- **References**:\n  - [1] Al Jazeera, The Guardian, ANHA, Reuters: https://en.wikipedia.org/wiki/Portal:Current_events/January_2026\n\n### Russian-made Shahd drone hits Kharkiv passenger train\n- **Time**: 2026-01-27\n- **Source**: Kyivpost (ISW assessment)\n- **Summary**: According to a report by the Kyiv Post citing an assessment by an international security organization, Russian forces used a modified Shahd drone to attack a passenger train in Ukraine's Kharkiv region, resulting in the deaths of at least five civilians and injuries to many others. Such drones are considered a new type of weapon in Russia's winter offensive.\n- **References**:\n  - [1] Kyivpost (ISW assessment): https://www.kyivpost.com/post/68911\n\n### US military to conduct multi-day joint exercises in the Middle East\n- **Time**: 2026-01-28\n- **Source**: The Defense Post\n- **Summary**: According to the Defense Post, the U.S. Department of Defense announced today that it will conduct several days of joint military exercises in the Middle East to enhance interoperability with regional partners and counter the threat of extremism. The exercises will include coordinated operations by air, sea, and ground forces.\n- **References**:\n  - [1] The Defense Post: https://thedefensepost.com/2026/01/28/us-exercise-middle-east/\n\n### Inuit people are key players in the future of the Arctic.\n- **Time**: 2026-01-28\n- **Source**: The Tyee\n- **Summary**: According to a feature article in *The Tyee*, Inuit traditional knowledge and community governance are considered central to enhancing security and climate resilience in the Arctic region. The article points out that Canada is planning to invest in infrastructure and legal frameworks to ensure that actions by external powers in the region align with Indigenous rights.\n- **References**:\n  - [1] The Tyee: https://thetyee.ca/Analysis/2026/01/28/Inuit-Hold-Keys-Arctic-Future/\n\n### Trump threatens NATO, Europe reassesses its security strategy\n- **Time**: 2026-01-28\n- **Source**: Instaforex\n- **Summary**: According to an analysis by Instaforex, Trump's recent repeated threats to withdraw from NATO have forced European countries to re-examine their own defense systems. The report points out that establishing a new defense alliance would require years and billions of dollars, making negotiations with the United States the lowest-cost option in the short term.\n- **References**:\n  - [1] Instaforex: https://www.instaforex.com/forex_analysis/436598\n\n### Two senior Chinese military officers have been dismissed.\n- **Time**: 2026-01-28\n- **Source**: South China Morning Post\n- **Summary**: According to the South China Morning Post, the Chinese military announced today the removal of two senior generals from their posts. This move is seen as a high-level personnel adjustment in the ongoing military reforms aimed at accelerating the modernization of the armed forces.\n- **References**:\n  - [1] South China Morning Post: https://www.scmp.com/news/china\n\n### The US and South Korea are locked in a trade impasse over a technology bill.\n- **Time**: 2026-01-28\n- **Source**: The Japan Times\n- **Summary**: According to The Japan Times, the United States and South Korea are embroiled in a trade dispute over technology export controls and regulations. Disagreements between the two sides on the licensing and regulation of high-tech products have caused fluctuations in bilateral trade and affected supply chain security.\n- **References**:\n  - [1] The Japan Times: https://www.japantimes.co.jp/business/2026/01/28/tech/us-trade-south-korea-tech-laws/\n\n### Bangladesh announces plans for the Mirsarai Defense Industrial Park\n- **Time**: 2026-01-27\n- **Source**: The Business Standard (TBS)\n- **Summary**: According to the Bangladesh Business Standard, Bangladesh plans to build a 600-650 acre defense industrial park in the Mirsarai area of Chittagong, and simultaneously establish its first free trade zone, aiming to enhance the security of the country's defense supply chain and attract foreign investment.\n- **References**:\n  - [1] The Business Standard (TBS): https://www.tbsnews.net/economy/military-economic-zone-be-set-mirsarai-national-special-economic-zone-bida-chief-1344366\n\n### Malaysian Defense Minister warns that military corruption jeopardizes national security\n- **Time**: 2026-01-28\n- **Source**: Malay Mail\n- **Summary**: According to the Malay Mail, the Malaysian Defense Minister stated today that corruption within the military has escalated into a major threat to national security, and called for strengthened auditing and oversight to prevent the misappropriation of public funds.\n- **References**:\n  - [1] Malay Mail: https://www.malaymail.com/news/malaysia/2026/01/28/defence-minister-corruption-in-military-is-threat-to-national-security-not-just-embezzlement/207123\n\n### Latest reports on the ongoing conflict in Israel\n- **Time**: 2026-01-28\n- **Source**: Spreaker – Israel Today\n- **Summary**: According to the latest update from the Israel Today podcast, airstrikes and ground clashes continued in the Gaza Strip over the past 24 hours, Israel reinforced its northern defenses, casualty figures on both sides continued to rise, and regional tensions showed no signs of easing.\n- **References**:\n  - [1] Spreaker – Israel Today: https://www.spreaker.com/podcast/israel-today-ongoing-war-report\n\n### The United States carried out a raid in Venezuela, detaining Maduro and his wife.\n- **Time**: 2026-01-27\n- **Source**: CBS News\n- **Summary**: According to CBS News, at an emergency meeting of the UN Security Council, US Ambassador Michael Waltz defended the US arrest of Nicolás Maduro and his wife in Venezuela; meanwhile, the US State Department called on US citizens to leave the country, citing threats posed by local militia groups to foreign nationals.\n- **References**:\n  - [1] CBS News: https://www.cbsnews.com/tag/united-nations/\n\n### The Security Council adopted a US draft resolution approving the Gaza Stabilization Force.\n- **Time**: 2026-01-27\n- **Source**: CBS News\n- **Summary**: According to CBS News, the UN Security Council voted to pass a US-submitted resolution authorizing the deployment of an international stabilization force in Gaza to provide security and assist in humanitarian relief efforts. This move is seen as a major breakthrough in US diplomacy in the Middle East.\n- **References**:\n  - [1] CBS News: https://www.cbsnews.com/tag/united-nations/\n\n### Israel approves the construction of 19 new settlements in the West Bank.\n- **Time**: 2026-01-27\n- **Source**: CBS News\n- **Summary**: According to CBS News, the Israeli cabinet today approved 19 new settlement projects in the West Bank, a move that has sparked strong protests from the Palestinians and drawn widespread criticism from the international community, which sees it as an obstacle to the two-state solution.\n- **References**:\n  - [1] CBS News: https://www.cbsnews.com/tag/united-nations/\n\n### Operation Falcon Eye: US Airstrikes on ISIS Strongholds in Syria\n- **Time**: 2026-01-27\n- **Source**: Sky News\n- **Summary**: According to Sky News, the U.S. Air Force launched Operation Falcon Eye in Syria today, conducting multiple waves of airstrikes against remnants of the Islamic State, aimed at weakening its combat capabilities and preventing the terrorist organization from reorganizing.\n- **References**:\n  - [1] Sky News: 未知\n\n### Russia and India will hold joint naval exercises in the Bay of Bengal.\n- **Time**: 2026-01-28\n- **Source**: The Independent\n- **Summary**: According to The Independent, the Russian and Indian navies plan to conduct joint exercises in the Bay of Bengal in February, a move aimed at enhancing maritime operational coordination and further consolidating their strategic presence in the Indian Ocean.\n- **References**:\n  - [1] The Independent: https://www.independent.co.uk/news/world/europe/ukraine-russia-war-live-putin-trump-zelensky-drone-strikes-b2909048.html\n\n### Malte Rutte's praise of Trump sparks friction within NATO.\n- **Time**: 2026-01-28\n- **Source**: POLITICO\n- **Summary**: According to POLITICO, Dutch Prime Minister and NATO Secretary General Marte Rutte's public praise of US President Trump has raised concerns among other EU member states about NATO unity, with fears that the US's unilateralist tendencies could weaken the alliance's ability to act in unison.\n- **References**:\n  - [1] POLITICO: https://www.politico.eu/section/policy/\n\n### Rutte warned that Europe would struggle to defend itself without US support.\n- **Time**: 2026-01-28\n- **Source**: POLITICO\n- **Summary**: According to POLITICO, NATO Secretary General and Dutch Prime Minister Mark Rutte warned in a recent media interview that Europe would face the risk of insufficient capacity if it attempted to defend itself without the United States, and therefore must maintain close strategic cooperation with Washington.\n- **References**:\n  - [1] POLITICO: https://www.politico.eu/section/policy/\n\n### What are the consequences of Trump's disruption of the global order?\n- **Time**: 2026-01-27\n- **Source**: POLITICO\n- **Summary**: According to an analysis by POLITICO, Trump’s unilateral actions are reshaping the post-Cold War liberal order. The article assesses its impact on small and medium-sized powers and explores the potential reshuffling of the future geopolitical landscape.\n- **References**:\n  - [1] POLITICO: https://www.politico.com/news/magazine/2026/01/27/post-nato-middle-powers-expert-roundup-00748549\n\n### The United States cuts $200 million in humanitarian aid to the United Nations.\n- **Time**: 2026-01-27\n- **Source**: CBS News\n- **Summary**: According to CBS News, the U.S. government recently announced cuts of up to $200 million in funding to the United Nations humanitarian aid program, forcing UN agencies to reallocate aid projects amid resource constraints.\n- **References**:\n  - [1] CBS News: https://www.cbsnews.com/tag/united-nations/\n\n### U.S. Senator Robbie warned that Venezuela could face military action if it deviates from U.S. objectives.\n- **Time**: 2026-01-27\n- **Source**: KSAT (Associated Press)\n- **Summary**: According to our report, on January 27, 2026, U.S. Senator Marcos Robbie stated at a press conference that if Venezuela's new leadership deviates from the established goals of the United States in its policies, Washington will have to consider further military action to protect its interests in the region. Robbie pointed out that Venezuela's current political trajectory has significantly diverged from the U.S. position, particularly regarding energy cooperation and regional security. The U.S. Department of Defense has not yet officially responded to this statement, but analysts generally believe that this warning may indicate a more hardline U.S. policy toward Latin American affairs. This statement triggered a strong backlash from the Venezuelan government. A spokesperson for the Venezuelan Ministry of Foreign Affairs stated that Venezuela will firmly safeguard its national sovereignty and will not accept external interference. This concludes our report. Please stay tuned for further updates.\n- **References**:\n  - [1] KSAT (Associated Press):",
  "modelName": "gpt-oss:120b-cloud",
  "lang": "en",
  "newsItems": [
    {
      "source": "Daily News – European Commission",
      "date": "2026-01-27",
      "title": "The EU advances its secure satellite communications plan, with GOVSATCOM and IRIS² officially launched.",
      "summary": "According to the European Commission's daily press release, the EU announced today the launch of two key satellite projects: GOVSATCOM, providing secure government and military satellite links for all member states, and IRIS², which is scheduled to begin service in 2029. Both projects aim to reduce reliance on non-EU suppliers, enhance strategic autonomy, and build the EU's own secure connectivity network within the next decade.",
      "url": "https://ec.europa.eu/commission/presscorner/detail/en/mex_26_245",
      "references": [
        {
          "id": 1,
          "source": "Daily News – European Commission",
          "url": "https://ec.europa.eu/commission/presscorner/detail/en/mex_26_245"
        }
      ]
    },
    {
      "source": "Vision Times",
      "date": "2026-01-27",
      "title": "The Greenland controversy highlights Europe's security dilemma",
      "summary": "According to the Global Times, the recent renewed interest from the United States in Greenland has sparked concerns within the European Union about its northern defenses. Analysts point out that without deep transatlantic coordination, Europe will struggle to independently defend its Arctic frontiers, and this dispute further exposes the EU's shortcomings in strategic resources and defense autonomy.",
      "url": "https://www.visiontimes.com/2026/01/27/greenland-controversy-highlights-europes-security-dilemma.html",
      "references": [
        {
          "id": 1,
          "source": "Vision Times",
          "url": "https://www.visiontimes.com/2026/01/27/greenland-controversy-highlights-europes-security-dilemma.html"
        }
      ]
    },
    {
      "source": "Eurasia Review",
      "date": "2026-01-27",
      "title": "NATO Secretary General attends European Parliament Security and Defence Committee meeting, calls for accelerated defense spending.",
      "summary": "According to Eurasia Review, NATO Secretary General Mark Rutte addressed the European Parliament's External Affairs Committee (AFET) and Security and Defence Committee (SEDE) in Brussels today. He emphasized that in the face of the continued threats from Russia and China, member states must increase their defense budgets, continue to support Ukraine, and strengthen NATO and EU interoperability.",
      "url": "https://www.eurasiareview.com/27012026-nato-secretary-general-attends-meeting-of-european-parliaments-committee-on-security-and-defence/",
      "references": [
        {
          "id": 1,
          "source": "Eurasia Review",
          "url": "https://www.eurasiareview.com/27012026-nato-secretary-general-attends-meeting-of-european-parliaments-committee-on-security-and-defence/"
        }
      ]
    },
    {
      "source": "The Star (Malaysia)",
      "date": "2026-01-27",
      "title": "The EU-India summit signed a free trade and defense cooperation agreement.",
      "summary": "According to Malaysia's *The Star*, the 16th India-EU Summit concluded in New Delhi, with the two sides signing several agreements, including a free trade agreement, and reaching a memorandum of understanding on defense cooperation. The agreements cover joint naval exercises, cyber threat countermeasures, and space security dialogue, marking a further deepening of the strategic partnership between the two major economies amidst global instability.",
      "url": "https://www.thestar.com.my/aseanplus/aseanplus-news/2026/01/27/india-and-eu-seek-economic-security-in-turbulent-times",
      "references": [
        {
          "id": 1,
          "source": "The Star (Malaysia)",
          "url": "https://www.thestar.com.my/aseanplus/aseanplus-news/2026/01/27/india-and-eu-seek-economic-security-in-turbulent-times"
        }
      ]
    },
    {
      "source": "The Washington Post",
      "date": "2026-01-27",
      "title": "Poland expands its military, becoming the largest army in the EU.",
      "summary": "According to The Washington Post, the Polish government announced today a significant expansion of its armed forces, planning to increase the size of its combat troops to nearly 300,000, making it the largest standing army within the European Union. This move is seen as a key step in deterring Russia's hybrid warfare capabilities and also reflects Poland's self-positioning in the regional security landscape.",
      "url": "https://www.washingtonpost.com/world/2026/01/27/poland-military-europe-hybrid-threats/",
      "references": [
        {
          "id": 1,
          "source": "The Washington Post",
          "url": "https://www.washingtonpost.com/world/2026/01/27/poland-military-europe-hybrid-threats/"
        }
      ]
    },
    {
      "source": "The Telegraph",
      "date": "2026-01-27",
      "title": "Bureaucracy may cause the British Royal Navy to lag behind China.",
      "summary": "According to The Daily Telegraph, British defense experts have warned that cumbersome approval processes are slowing down the development of the Royal Navy's next generation of warships. Without expedited decision-making, the British naval force may face a significant capability gap in competition with China's modern fleet.",
      "url": "https://www.telegraph.co.uk/news/2026/01/27/red-tape-could-sink-navys-ability-to-keep-up-with-china/",
      "references": [
        {
          "id": 1,
          "source": "The Telegraph",
          "url": "https://www.telegraph.co.uk/news/2026/01/27/red-tape-could-sink-navys-ability-to-keep-up-with-china/"
        }
      ]
    },
    {
      "source": "Philstar",
      "date": "2026-01-28",
      "title": "Trump reiterates sovereignty claim over Greenland",
      "summary": "According to a commentary in the Philippine Star, former US President Trump's renewed public claim to sovereignty over Greenland has sparked a new round of diplomatic tensions among European allies and prompted NATO to reassess its defense posture in the Arctic region.",
      "url": "https://www.philstar.com/opinion/2026/01/28/2503929/why-trump-insists-getting-greenland",
      "references": [
        {
          "id": 1,
          "source": "Philstar",
          "url": "https://www.philstar.com/opinion/2026/01/28/2503929/why-trump-insists-getting-greenland"
        }
      ]
    },
    {
      "source": "Indiplomacy",
      "date": "2026-01-28",
      "title": "Senior New Zealand defense officials inspect \"Thunder Warriors\" exercise",
      "summary": "According to Indiplomacy, New Zealand's Senior Minister of Defence inspected the \"Thunder Warrior\" joint exercise this week at the Waioru Military Training Area. The exercise, which involves the New Zealand Defence Force and Singapore Special Forces, aims to enhance regional security cooperation and rapid response capabilities.",
      "url": "https://indiplomacy.com/2026/01/28/senior-minister-of-state-for-defence-visits-saf-troops-at-exercise-thunder-warrior-in-new-zealand/",
      "references": [
        {
          "id": 1,
          "source": "Indiplomacy",
          "url": "https://indiplomacy.com/2026/01/28/senior-minister-of-state-for-defence-visits-saf-troops-at-exercise-thunder-warrior-in-new-zealand/"
        }
      ]
    },
    {
      "source": "Reuters (via Wikipedia portal)",
      "date": "2026-01-27",
      "title": "A suicide bombing at a Chinese restaurant in Kabul killed seven people.",
      "summary": "According to a Reuters report relayed via Wikipedia's current events page, a suicide bombing at a Chinese restaurant in Kabul's New Nawa district on January 27, 2026, killed seven civilians and injured more than twenty. The Islamic State's Khugus group claimed responsibility for the attack, highlighting the ongoing conflict between terrorist groups and the Taliban in Afghanistan.",
      "url": "https://en.wikipedia.org/wiki/Portal:Current_events/January_2026",
      "references": [
        {
          "id": 1,
          "source": "Reuters (via Wikipedia portal)",
          "url": "https://en.wikipedia.org/wiki/Portal:Current_events/January_2026"
        }
      ]
    },
    {
      "source": "Middle East Eye / Dawan Africa / The New Arab",
      "date": "2026-01-27",
      "title": "Somalia terminates all port agreements with the UAE",
      "summary": "According to reports from multiple media outlets, including Middle East Eye, the Somali government cabinet announced today the termination of all cooperation agreements with the United Arab Emirates in the three major ports of Bereira, Bosavo, and Kismayo, accusing the UAE of supporting the Serlan region in northern Somalia. This move was immediately met with opposition from the local governments of Serlan, Bantusa, and Jubaran.",
      "url": "https://en.wikipedia.org/wiki/Portal:Current_events/January_2026",
      "references": [
        {
          "id": 1,
          "source": "Middle East Eye / Dawan Africa / The New Arab",
          "url": "https://en.wikipedia.org/wiki/Portal:Current_events/January_2026"
        }
      ]
    },
    {
      "source": "Al Jazeera, The Guardian, ANHA, Reuters",
      "date": "2026-01-27",
      "title": "Fierce fighting escalates in Kurdish region; Syrian forces capture Ain Issa and Salin.",
      "summary": "According to multiple international media reports, despite a ceasefire announced the previous day, Syrian government forces launched an offensive today in northern Kurdistan, capturing the towns of Ain Issa and Salim, and raiding the Al-Shadah prison, resulting in the escape of several ISIS fighters. The conflict has exacerbated the humanitarian crisis in the region.",
      "url": "https://en.wikipedia.org/wiki/Portal:Current_events/January_2026",
      "references": [
        {
          "id": 1,
          "source": "Al Jazeera, The Guardian, ANHA, Reuters",
          "url": "https://en.wikipedia.org/wiki/Portal:Current_events/January_2026"
        }
      ]
    },
    {
      "source": "Kyivpost (ISW assessment)",
      "date": "2026-01-27",
      "title": "Russian-made Shahd drone hits Kharkiv passenger train",
      "summary": "According to a report by the Kyiv Post citing an assessment by an international security organization, Russian forces used a modified Shahd drone to attack a passenger train in Ukraine's Kharkiv region, resulting in the deaths of at least five civilians and injuries to many others. Such drones are considered a new type of weapon in Russia's winter offensive.",
      "url": "https://www.kyivpost.com/post/68911",
      "references": [
        {
          "id": 1,
          "source": "Kyivpost (ISW assessment)",
          "url": "https://www.kyivpost.com/post/68911"
        }
      ]
    },
    {
      "source": "The Defense Post",
      "date": "2026-01-28",
      "title": "US military to conduct multi-day joint exercises in the Middle East",
      "summary": "According to the Defense Post, the U.S. Department of Defense announced today that it will conduct several days of joint military exercises in the Middle East to enhance interoperability with regional partners and counter the threat of extremism. The exercises will include coordinated operations by air, sea, and ground forces.",
      "url": "https://thedefensepost.com/2026/01/28/us-exercise-middle-east/",
      "references": [
        {
          "id": 1,
          "source": "The Defense Post",
          "url": "https://thedefensepost.com/2026/01/28/us-exercise-middle-east/"
        }
      ]
    },
    {
      "source": "The Tyee",
      "date": "2026-01-28",
      "title": "Inuit people are key players in the future of the Arctic.",
      "summary": "According to a feature article in *The Tyee*, Inuit traditional knowledge and community governance are considered central to enhancing security and climate resilience in the Arctic region. The article points out that Canada is planning to invest in infrastructure and legal frameworks to ensure that actions by external powers in the region align with Indigenous rights.",
      "url": "https://thetyee.ca/Analysis/2026/01/28/Inuit-Hold-Keys-Arctic-Future/",
      "references": [
        {
          "id": 1,
          "source": "The Tyee",
          "url": "https://thetyee.ca/Analysis/2026/01/28/Inuit-Hold-Keys-Arctic-Future/"
        }
      ]
    },
    {
      "source": "Instaforex",
      "date": "2026-01-28",
      "title": "Trump threatens NATO, Europe reassesses its security strategy",
      "summary": "According to an analysis by Instaforex, Trump's recent repeated threats to withdraw from NATO have forced European countries to re-examine their own defense systems. The report points out that establishing a new defense alliance would require years and billions of dollars, making negotiations with the United States the lowest-cost option in the short term.",
      "url": "https://www.instaforex.com/forex_analysis/436598",
      "references": [
        {
          "id": 1,
          "source": "Instaforex",
          "url": "https://www.instaforex.com/forex_analysis/436598"
        }
      ]
    },
    {
      "source": "South China Morning Post",
      "date": "2026-01-28",
      "title": "Two senior Chinese military officers have been dismissed.",
      "summary": "According to the South China Morning Post, the Chinese military announced today the removal of two senior generals from their posts. This move is seen as a high-level personnel adjustment in the ongoing military reforms aimed at accelerating the modernization of the armed forces.",
      "url": "https://www.scmp.com/news/china",
      "references": [
        {
          "id": 1,
          "source": "South China Morning Post",
          "url": "https://www.scmp.com/news/china"
        }
      ]
    },
    {
      "source": "The Japan Times",
      "date": "2026-01-28",
      "title": "The US and South Korea are locked in a trade impasse over a technology bill.",
      "summary": "According to The Japan Times, the United States and South Korea are embroiled in a trade dispute over technology export controls and regulations. Disagreements between the two sides on the licensing and regulation of high-tech products have caused fluctuations in bilateral trade and affected supply chain security.",
      "url": "https://www.japantimes.co.jp/business/2026/01/28/tech/us-trade-south-korea-tech-laws/",
      "references": [
        {
          "id": 1,
          "source": "The Japan Times",
          "url": "https://www.japantimes.co.jp/business/2026/01/28/tech/us-trade-south-korea-tech-laws/"
        }
      ]
    },
    {
      "source": "The Business Standard (TBS)",
      "date": "2026-01-27",
      "title": "Bangladesh announces plans for the Mirsarai Defense Industrial Park",
      "summary": "According to the Bangladesh Business Standard, Bangladesh plans to build a 600-650 acre defense industrial park in the Mirsarai area of Chittagong, and simultaneously establish its first free trade zone, aiming to enhance the security of the country's defense supply chain and attract foreign investment.",
      "url": "https://www.tbsnews.net/economy/military-economic-zone-be-set-mirsarai-national-special-economic-zone-bida-chief-1344366",
      "references": [
        {
          "id": 1,
          "source": "The Business Standard (TBS)",
          "url": "https://www.tbsnews.net/economy/military-economic-zone-be-set-mirsarai-national-special-economic-zone-bida-chief-1344366"
        }
      ]
    },
    {
      "source": "Malay Mail",
      "date": "2026-01-28",
      "title": "Malaysian Defense Minister warns that military corruption jeopardizes national security",
      "summary": "According to the Malay Mail, the Malaysian Defense Minister stated today that corruption within the military has escalated into a major threat to national security, and called for strengthened auditing and oversight to prevent the misappropriation of public funds.",
      "url": "https://www.malaymail.com/news/malaysia/2026/01/28/defence-minister-corruption-in-military-is-threat-to-national-security-not-just-embezzlement/207123",
      "references": [
        {
          "id": 1,
          "source": "Malay Mail",
          "url": "https://www.malaymail.com/news/malaysia/2026/01/28/defence-minister-corruption-in-military-is-threat-to-national-security-not-just-embezzlement/207123"
        }
      ]
    },
    {
      "source": "Spreaker – Israel Today",
      "date": "2026-01-28",
      "title": "Latest reports on the ongoing conflict in Israel",
      "summary": "According to the latest update from the Israel Today podcast, airstrikes and ground clashes continued in the Gaza Strip over the past 24 hours, Israel reinforced its northern defenses, casualty figures on both sides continued to rise, and regional tensions showed no signs of easing.",
      "url": "https://www.spreaker.com/podcast/israel-today-ongoing-war-report",
      "references": [
        {
          "id": 1,
          "source": "Spreaker – Israel Today",
          "url": "https://www.spreaker.com/podcast/israel-today-ongoing-war-report"
        }
      ]
    },
    {
      "source": "CBS News",
      "date": "2026-01-27",
      "title": "The United States carried out a raid in Venezuela, detaining Maduro and his wife.",
      "summary": "According to CBS News, at an emergency meeting of the UN Security Council, US Ambassador Michael Waltz defended the US arrest of Nicolás Maduro and his wife in Venezuela; meanwhile, the US State Department called on US citizens to leave the country, citing threats posed by local militia groups to foreign nationals.",
      "url": "https://www.cbsnews.com/tag/united-nations/",
      "references": [
        {
          "id": 1,
          "source": "CBS News",
          "url": "https://www.cbsnews.com/tag/united-nations/"
        }
      ]
    },
    {
      "source": "CBS News",
      "date": "2026-01-27",
      "title": "The Security Council adopted a US draft resolution approving the Gaza Stabilization Force.",
      "summary": "According to CBS News, the UN Security Council voted to pass a US-submitted resolution authorizing the deployment of an international stabilization force in Gaza to provide security and assist in humanitarian relief efforts. This move is seen as a major breakthrough in US diplomacy in the Middle East.",
      "url": "https://www.cbsnews.com/tag/united-nations/",
      "references": [
        {
          "id": 1,
          "source": "CBS News",
          "url": "https://www.cbsnews.com/tag/united-nations/"
        }
      ]
    },
    {
      "source": "CBS News",
      "date": "2026-01-27",
      "title": "Israel approves the construction of 19 new settlements in the West Bank.",
      "summary": "According to CBS News, the Israeli cabinet today approved 19 new settlement projects in the West Bank, a move that has sparked strong protests from the Palestinians and drawn widespread criticism from the international community, which sees it as an obstacle to the two-state solution.",
      "url": "https://www.cbsnews.com/tag/united-nations/",
      "references": [
        {
          "id": 1,
          "source": "CBS News",
          "url": "https://www.cbsnews.com/tag/united-nations/"
        }
      ]
    },
    {
      "source": "Sky News",
      "date": "2026-01-27",
      "title": "Operation Falcon Eye: US Airstrikes on ISIS Strongholds in Syria",
      "summary": "According to Sky News, the U.S. Air Force launched Operation Falcon Eye in Syria today, conducting multiple waves of airstrikes against remnants of the Islamic State, aimed at weakening its combat capabilities and preventing the terrorist organization from reorganizing.",
      "url": "未知",
      "references": [
        {
          "id": 1,
          "source": "Sky News",
          "url": "未知"
        }
      ]
    },
    {
      "source": "The Independent",
      "date": "2026-01-28",
      "title": "Russia and India will hold joint naval exercises in the Bay of Bengal.",
      "summary": "According to The Independent, the Russian and Indian navies plan to conduct joint exercises in the Bay of Bengal in February, a move aimed at enhancing maritime operational coordination and further consolidating their strategic presence in the Indian Ocean.",
      "url": "https://www.independent.co.uk/news/world/europe/ukraine-russia-war-live-putin-trump-zelensky-drone-strikes-b2909048.html",
      "references": [
        {
          "id": 1,
          "source": "The Independent",
          "url": "https://www.independent.co.uk/news/world/europe/ukraine-russia-war-live-putin-trump-zelensky-drone-strikes-b2909048.html"
        }
      ]
    },
    {
      "source": "POLITICO",
      "date": "2026-01-28",
      "title": "Malte Rutte's praise of Trump sparks friction within NATO.",
      "summary": "According to POLITICO, Dutch Prime Minister and NATO Secretary General Marte Rutte's public praise of US President Trump has raised concerns among other EU member states about NATO unity, with fears that the US's unilateralist tendencies could weaken the alliance's ability to act in unison.",
      "url": "https://www.politico.eu/section/policy/",
      "references": [
        {
          "id": 1,
          "source": "POLITICO",
          "url": "https://www.politico.eu/section/policy/"
        }
      ]
    },
    {
      "source": "POLITICO",
      "date": "2026-01-28",
      "title": "Rutte warned that Europe would struggle to defend itself without US support.",
      "summary": "According to POLITICO, NATO Secretary General and Dutch Prime Minister Mark Rutte warned in a recent media interview that Europe would face the risk of insufficient capacity if it attempted to defend itself without the United States, and therefore must maintain close strategic cooperation with Washington.",
      "url": "https://www.politico.eu/section/policy/",
      "references": [
        {
          "id": 1,
          "source": "POLITICO",
          "url": "https://www.politico.eu/section/policy/"
        }
      ]
    },
    {
      "source": "POLITICO",
      "date": "2026-01-27",
      "title": "What are the consequences of Trump's disruption of the global order?",
      "summary": "According to an analysis by POLITICO, Trump’s unilateral actions are reshaping the post-Cold War liberal order. The article assesses its impact on small and medium-sized powers and explores the potential reshuffling of the future geopolitical landscape.",
      "url": "https://www.politico.com/news/magazine/2026/01/27/post-nato-middle-powers-expert-roundup-00748549",
      "references": [
        {
          "id": 1,
          "source": "POLITICO",
          "url": "https://www.politico.com/news/magazine/2026/01/27/post-nato-middle-powers-expert-roundup-00748549"
        }
      ]
    },
    {
      "source": "CBS News",
      "date": "2026-01-27",
      "title": "The United States cuts $200 million in humanitarian aid to the United Nations.",
      "summary": "According to CBS News, the U.S. government recently announced cuts of up to $200 million in funding to the United Nations humanitarian aid program, forcing UN agencies to reallocate aid projects amid resource constraints.",
      "url": "https://www.cbsnews.com/tag/united-nations/",
      "references": [
        {
          "id": 1,
          "source": "CBS News",
          "url": "https://www.cbsnews.com/tag/united-nations/"
        }
      ]
    },
    {
      "source": "KSAT (Associated Press)",
      "date": "2026-01-27",
      "title": "U.S. Senator Robbie warned that Venezuela could face military action if it deviates from U.S. objectives.",
      "summary": "According to our report, on January 27, 2026, U.S. Senator Marcos Robbie stated at a press conference that if Venezuela's new leadership deviates from the established goals of the United States in its policies, Washington will have to consider further military action to protect its interests in the region. Robbie pointed out that Venezuela's current political trajectory has significantly diverged from the U.S. position, particularly regarding energy cooperation and regional security. The U.S. Department of Defense has not yet officially responded to this statement, but analysts generally believe that this warning may indicate a more hardline U.S. policy toward Latin American affairs. This statement triggered a strong backlash from the Venezuelan government. A spokesperson for the Venezuelan Ministry of Foreign Affairs stated that Venezuela will firmly safeguard its national sovereignty and will not accept external interference. This concludes our report. Please stay tuned for further updates.",
      "url": "",
      "references": [
        {
          "id": 1,
          "source": "KSAT (Associated Press)",
          "url": ""
        }
      ]
    }
  ],
  "references": [],
  "executiveSummary": "Welcome to the Daily News Channel, I'm Joe. In the past 24 hours, the global security landscape has once again become volatile: Europe, while strengthening its satellite communications and defense autonomy, faces subtle shifts in the relationship between NATO and the United States; the United States has conducted military exercises and operations in the Middle East and Latin America, while simultaneously reducing humanitarian aid to the United Nations; in Asia, India and the European Union have deepened their economic and security cooperation, and India and Russia plan joint naval exercises in the Bay of Bengal; and in the Arctic, the dispute over Greenland has reignited geopolitical tensions. In addition, the Russia-Ukraine conflict, the Syrian war, and terrorist attacks continue. Today, we will quickly summarize the background and context of these important events.",
  "audioRecords": [
    {
      "id": "75567010-74bf-40ad-8690-be17a86ea170",
      "date": "2026/1/28 20:20:43",
      "lang": "en",
      "model": "gcp",
      "voice": "Edge/晓晓 (女声 - 亲切)",
      "blobId": "audio_2026-01-28-en.mp3"
    }
  ],
  "fullContent": "# Chief Intelligence Officer - Daily Brief\n**Topic**: Latest global political and military news\n**Time**: 2026/1/28 16:56\n\n## Situation Overview\nWelcome to the Daily News Channel, I'm Joe. In the past 24 hours, the global security landscape has once again become volatile: Europe, while strengthening its satellite communications and defense autonomy, faces subtle shifts in the relationship between NATO and the United States; the United States has conducted military exercises and operations in the Middle East and Latin America, while simultaneously reducing humanitarian aid to the United Nations; in Asia, India and the European Union have deepened their economic and security cooperation, and India and Russia plan joint naval exercises in the Bay of Bengal; and in the Arctic, the dispute over Greenland has reignited geopolitical tensions. In addition, the Russia-Ukraine conflict, the Syrian war, and terrorist attacks continue. Today, we will quickly summarize the background and context of these important events.\n\n## Key Intelligence\n### The EU advances its secure satellite communications plan, with GOVSATCOM and IRIS² officially launched.\n- **Time**: 2026-01-27\n- **Source**: Daily News – European Commission\n- **Summary**: According to the European Commission's daily press release, the EU announced today the launch of two key satellite projects: GOVSATCOM, providing secure government and military satellite links for all member states, and IRIS², which is scheduled to begin service in 2029. Both projects aim to reduce reliance on non-EU suppliers, enhance strategic autonomy, and build the EU's own secure connectivity network within the next decade.\n- **References**:\n  - [1] Daily News – European Commission: https://ec.europa.eu/commission/presscorner/detail/en/mex_26_245\n\n### The Greenland controversy highlights Europe's security dilemma\n- **Time**: 2026-01-27\n- **Source**: Vision Times\n- **Summary**: According to the Global Times, the recent renewed interest from the United States in Greenland has sparked concerns within the European Union about its northern defenses. Analysts point out that without deep transatlantic coordination, Europe will struggle to independently defend its Arctic frontiers, and this dispute further exposes the EU's shortcomings in strategic resources and defense autonomy.\n- **References**:\n  - [1] Vision Times: https://www.visiontimes.com/2026/01/27/greenland-controversy-highlights-europes-security-dilemma.html\n\n### NATO Secretary General attends European Parliament Security and Defence Committee meeting, calls for accelerated defense spending.\n- **Time**: 2026-01-27\n- **Source**: Eurasia Review\n- **Summary**: According to Eurasia Review, NATO Secretary General Mark Rutte addressed the European Parliament's External Affairs Committee (AFET) and Security and Defence Committee (SEDE) in Brussels today. He emphasized that in the face of the continued threats from Russia and China, member states must increase their defense budgets, continue to support Ukraine, and strengthen NATO and EU interoperability.\n- **References**:\n  - [1] Eurasia Review: https://www.eurasiareview.com/27012026-nato-secretary-general-attends-meeting-of-european-parliaments-committee-on-security-and-defence/\n\n### The EU-India summit signed a free trade and defense cooperation agreement.\n- **Time**: 2026-01-27\n- **Source**: The Star (Malaysia)\n- **Summary**: According to Malaysia's *The Star*, the 16th India-EU Summit concluded in New Delhi, with the two sides signing several agreements, including a free trade agreement, and reaching a memorandum of understanding on defense cooperation. The agreements cover joint naval exercises, cyber threat countermeasures, and space security dialogue, marking a further deepening of the strategic partnership between the two major economies amidst global instability.\n- **References**:\n  - [1] The Star (Malaysia): https://www.thestar.com.my/aseanplus/aseanplus-news/2026/01/27/india-and-eu-seek-economic-security-in-turbulent-times\n\n### Poland expands its military, becoming the largest army in the EU.\n- **Time**: 2026-01-27\n- **Source**: The Washington Post\n- **Summary**: According to The Washington Post, the Polish government announced today a significant expansion of its armed forces, planning to increase the size of its combat troops to nearly 300,000, making it the largest standing army within the European Union. This move is seen as a key step in deterring Russia's hybrid warfare capabilities and also reflects Poland's self-positioning in the regional security landscape.\n- **References**:\n  - [1] The Washington Post: https://www.washingtonpost.com/world/2026/01/27/poland-military-europe-hybrid-threats/\n\n### Bureaucracy may cause the British Royal Navy to lag behind China.\n- **Time**: 2026-01-27\n- **Source**: The Telegraph\n- **Summary**: According to The Daily Telegraph, British defense experts have warned that cumbersome approval processes are slowing down the development of the Royal Navy's next generation of warships. Without expedited decision-making, the British naval force may face a significant capability gap in competition with China's modern fleet.\n- **References**:\n  - [1] The Telegraph: https://www.telegraph.co.uk/news/2026/01/27/red-tape-could-sink-navys-ability-to-keep-up-with-china/\n\n### Trump reiterates sovereignty claim over Greenland\n- **Time**: 2026-01-28\n- **Source**: Philstar\n- **Summary**: According to a commentary in the Philippine Star, former US President Trump's renewed public claim to sovereignty over Greenland has sparked a new round of diplomatic tensions among European allies and prompted NATO to reassess its defense posture in the Arctic region.\n- **References**:\n  - [1] Philstar: https://www.philstar.com/opinion/2026/01/28/2503929/why-trump-insists-getting-greenland\n\n### Senior New Zealand defense officials inspect \"Thunder Warriors\" exercise\n- **Time**: 2026-01-28\n- **Source**: Indiplomacy\n- **Summary**: According to Indiplomacy, New Zealand's Senior Minister of Defence inspected the \"Thunder Warrior\" joint exercise this week at the Waioru Military Training Area. The exercise, which involves the New Zealand Defence Force and Singapore Special Forces, aims to enhance regional security cooperation and rapid response capabilities.\n- **References**:\n  - [1] Indiplomacy: https://indiplomacy.com/2026/01/28/senior-minister-of-state-for-defence-visits-saf-troops-at-exercise-thunder-warrior-in-new-zealand/\n\n### A suicide bombing at a Chinese restaurant in Kabul killed seven people.\n- **Time**: 2026-01-27\n- **Source**: Reuters (via Wikipedia portal)\n- **Summary**: According to a Reuters report relayed via Wikipedia's current events page, a suicide bombing at a Chinese restaurant in Kabul's New Nawa district on January 27, 2026, killed seven civilians and injured more than twenty. The Islamic State's Khugus group claimed responsibility for the attack, highlighting the ongoing conflict between terrorist groups and the Taliban in Afghanistan.\n- **References**:\n  - [1] Reuters (via Wikipedia portal): https://en.wikipedia.org/wiki/Portal:Current_events/January_2026\n\n### Somalia terminates all port agreements with the UAE\n- **Time**: 2026-01-27\n- **Source**: Middle East Eye / Dawan Africa / The New Arab\n- **Summary**: According to reports from multiple media outlets, including Middle East Eye, the Somali government cabinet announced today the termination of all cooperation agreements with the United Arab Emirates in the three major ports of Bereira, Bosavo, and Kismayo, accusing the UAE of supporting the Serlan region in northern Somalia. This move was immediately met with opposition from the local governments of Serlan, Bantusa, and Jubaran.\n- **References**:\n  - [1] Middle East Eye / Dawan Africa / The New Arab: https://en.wikipedia.org/wiki/Portal:Current_events/January_2026\n\n### Fierce fighting escalates in Kurdish region; Syrian forces capture Ain Issa and Salin.\n- **Time**: 2026-01-27\n- **Source**: Al Jazeera, The Guardian, ANHA, Reuters\n- **Summary**: According to multiple international media reports, despite a ceasefire announced the previous day, Syrian government forces launched an offensive today in northern Kurdistan, capturing the towns of Ain Issa and Salim, and raiding the Al-Shadah prison, resulting in the escape of several ISIS fighters. The conflict has exacerbated the humanitarian crisis in the region.\n- **References**:\n  - [1] Al Jazeera, The Guardian, ANHA, Reuters: https://en.wikipedia.org/wiki/Portal:Current_events/January_2026\n\n### Russian-made Shahd drone hits Kharkiv passenger train\n- **Time**: 2026-01-27\n- **Source**: Kyivpost (ISW assessment)\n- **Summary**: According to a report by the Kyiv Post citing an assessment by an international security organization, Russian forces used a modified Shahd drone to attack a passenger train in Ukraine's Kharkiv region, resulting in the deaths of at least five civilians and injuries to many others. Such drones are considered a new type of weapon in Russia's winter offensive.\n- **References**:\n  - [1] Kyivpost (ISW assessment): https://www.kyivpost.com/post/68911\n\n### US military to conduct multi-day joint exercises in the Middle East\n- **Time**: 2026-01-28\n- **Source**: The Defense Post\n- **Summary**: According to the Defense Post, the U.S. Department of Defense announced today that it will conduct several days of joint military exercises in the Middle East to enhance interoperability with regional partners and counter the threat of extremism. The exercises will include coordinated operations by air, sea, and ground forces.\n- **References**:\n  - [1] The Defense Post: https://thedefensepost.com/2026/01/28/us-exercise-middle-east/\n\n### Inuit people are key players in the future of the Arctic.\n- **Time**: 2026-01-28\n- **Source**: The Tyee\n- **Summary**: According to a feature article in *The Tyee*, Inuit traditional knowledge and community governance are considered central to enhancing security and climate resilience in the Arctic region. The article points out that Canada is planning to invest in infrastructure and legal frameworks to ensure that actions by external powers in the region align with Indigenous rights.\n- **References**:\n  - [1] The Tyee: https://thetyee.ca/Analysis/2026/01/28/Inuit-Hold-Keys-Arctic-Future/\n\n### Trump threatens NATO, Europe reassesses its security strategy\n- **Time**: 2026-01-28\n- **Source**: Instaforex\n- **Summary**: According to an analysis by Instaforex, Trump's recent repeated threats to withdraw from NATO have forced European countries to re-examine their own defense systems. The report points out that establishing a new defense alliance would require years and billions of dollars, making negotiations with the United States the lowest-cost option in the short term.\n- **References**:\n  - [1] Instaforex: https://www.instaforex.com/forex_analysis/436598\n\n### Two senior Chinese military officers have been dismissed.\n- **Time**: 2026-01-28\n- **Source**: South China Morning Post\n- **Summary**: According to the South China Morning Post, the Chinese military announced today the removal of two senior generals from their posts. This move is seen as a high-level personnel adjustment in the ongoing military reforms aimed at accelerating the modernization of the armed forces.\n- **References**:\n  - [1] South China Morning Post: https://www.scmp.com/news/china\n\n### The US and South Korea are locked in a trade impasse over a technology bill.\n- **Time**: 2026-01-28\n- **Source**: The Japan Times\n- **Summary**: According to The Japan Times, the United States and South Korea are embroiled in a trade dispute over technology export controls and regulations. Disagreements between the two sides on the licensing and regulation of high-tech products have caused fluctuations in bilateral trade and affected supply chain security.\n- **References**:\n  - [1] The Japan Times: https://www.japantimes.co.jp/business/2026/01/28/tech/us-trade-south-korea-tech-laws/\n\n### Bangladesh announces plans for the Mirsarai Defense Industrial Park\n- **Time**: 2026-01-27\n- **Source**: The Business Standard (TBS)\n- **Summary**: According to the Bangladesh Business Standard, Bangladesh plans to build a 600-650 acre defense industrial park in the Mirsarai area of Chittagong, and simultaneously establish its first free trade zone, aiming to enhance the security of the country's defense supply chain and attract foreign investment.\n- **References**:\n  - [1] The Business Standard (TBS): https://www.tbsnews.net/economy/military-economic-zone-be-set-mirsarai-national-special-economic-zone-bida-chief-1344366\n\n### Malaysian Defense Minister warns that military corruption jeopardizes national security\n- **Time**: 2026-01-28\n- **Source**: Malay Mail\n- **Summary**: According to the Malay Mail, the Malaysian Defense Minister stated today that corruption within the military has escalated into a major threat to national security, and called for strengthened auditing and oversight to prevent the misappropriation of public funds.\n- **References**:\n  - [1] Malay Mail: https://www.malaymail.com/news/malaysia/2026/01/28/defence-minister-corruption-in-military-is-threat-to-national-security-not-just-embezzlement/207123\n\n### Latest reports on the ongoing conflict in Israel\n- **Time**: 2026-01-28\n- **Source**: Spreaker – Israel Today\n- **Summary**: According to the latest update from the Israel Today podcast, airstrikes and ground clashes continued in the Gaza Strip over the past 24 hours, Israel reinforced its northern defenses, casualty figures on both sides continued to rise, and regional tensions showed no signs of easing.\n- **References**:\n  - [1] Spreaker – Israel Today: https://www.spreaker.com/podcast/israel-today-ongoing-war-report\n\n### The United States carried out a raid in Venezuela, detaining Maduro and his wife.\n- **Time**: 2026-01-27\n- **Source**: CBS News\n- **Summary**: According to CBS News, at an emergency meeting of the UN Security Council, US Ambassador Michael Waltz defended the US arrest of Nicolás Maduro and his wife in Venezuela; meanwhile, the US State Department called on US citizens to leave the country, citing threats posed by local militia groups to foreign nationals.\n- **References**:\n  - [1] CBS News: https://www.cbsnews.com/tag/united-nations/\n\n### The Security Council adopted a US draft resolution approving the Gaza Stabilization Force.\n- **Time**: 2026-01-27\n- **Source**: CBS News\n- **Summary**: According to CBS News, the UN Security Council voted to pass a US-submitted resolution authorizing the deployment of an international stabilization force in Gaza to provide security and assist in humanitarian relief efforts. This move is seen as a major breakthrough in US diplomacy in the Middle East.\n- **References**:\n  - [1] CBS News: https://www.cbsnews.com/tag/united-nations/\n\n### Israel approves the construction of 19 new settlements in the West Bank.\n- **Time**: 2026-01-27\n- **Source**: CBS News\n- **Summary**: According to CBS News, the Israeli cabinet today approved 19 new settlement projects in the West Bank, a move that has sparked strong protests from the Palestinians and drawn widespread criticism from the international community, which sees it as an obstacle to the two-state solution.\n- **References**:\n  - [1] CBS News: https://www.cbsnews.com/tag/united-nations/\n\n### Operation Falcon Eye: US Airstrikes on ISIS Strongholds in Syria\n- **Time**: 2026-01-27\n- **Source**: Sky News\n- **Summary**: According to Sky News, the U.S. Air Force launched Operation Falcon Eye in Syria today, conducting multiple waves of airstrikes against remnants of the Islamic State, aimed at weakening its combat capabilities and preventing the terrorist organization from reorganizing.\n- **References**:\n  - [1] Sky News: 未知\n\n### Russia and India will hold joint naval exercises in the Bay of Bengal.\n- **Time**: 2026-01-28\n- **Source**: The Independent\n- **Summary**: According to The Independent, the Russian and Indian navies plan to conduct joint exercises in the Bay of Bengal in February, a move aimed at enhancing maritime operational coordination and further consolidating their strategic presence in the Indian Ocean.\n- **References**:\n  - [1] The Independent: https://www.independent.co.uk/news/world/europe/ukraine-russia-war-live-putin-trump-zelensky-drone-strikes-b2909048.html\n\n### Malte Rutte's praise of Trump sparks friction within NATO.\n- **Time**: 2026-01-28\n- **Source**: POLITICO\n- **Summary**: According to POLITICO, Dutch Prime Minister and NATO Secretary General Marte Rutte's public praise of US President Trump has raised concerns among other EU member states about NATO unity, with fears that the US's unilateralist tendencies could weaken the alliance's ability to act in unison.\n- **References**:\n  - [1] POLITICO: https://www.politico.eu/section/policy/\n\n### Rutte warned that Europe would struggle to defend itself without US support.\n- **Time**: 2026-01-28\n- **Source**: POLITICO\n- **Summary**: According to POLITICO, NATO Secretary General and Dutch Prime Minister Mark Rutte warned in a recent media interview that Europe would face the risk of insufficient capacity if it attempted to defend itself without the United States, and therefore must maintain close strategic cooperation with Washington.\n- **References**:\n  - [1] POLITICO: https://www.politico.eu/section/policy/\n\n### What are the consequences of Trump's disruption of the global order?\n- **Time**: 2026-01-27\n- **Source**: POLITICO\n- **Summary**: According to an analysis by POLITICO, Trump’s unilateral actions are reshaping the post-Cold War liberal order. The article assesses its impact on small and medium-sized powers and explores the potential reshuffling of the future geopolitical landscape.\n- **References**:\n  - [1] POLITICO: https://www.politico.com/news/magazine/2026/01/27/post-nato-middle-powers-expert-roundup-00748549\n\n### The United States cuts $200 million in humanitarian aid to the United Nations.\n- **Time**: 2026-01-27\n- **Source**: CBS News\n- **Summary**: According to CBS News, the U.S. government recently announced cuts of up to $200 million in funding to the United Nations humanitarian aid program, forcing UN agencies to reallocate aid projects amid resource constraints.\n- **References**:\n  - [1] CBS News: https://www.cbsnews.com/tag/united-nations/\n\n### U.S. Senator Robbie warned that Venezuela could face military action if it deviates from U.S. objectives.\n- **Time**: 2026-01-27\n- **Source**: KSAT (Associated Press)\n- **Summary**: According to our report, on January 27, 2026, U.S. Senator Marcos Robbie stated at a press conference that if Venezuela's new leadership deviates from the established goals of the United States in its policies, Washington will have to consider further military action to protect its interests in the region. Robbie pointed out that Venezuela's current political trajectory has significantly diverged from the U.S. position, particularly regarding energy cooperation and regional security. The U.S. Department of Defense has not yet officially responded to this statement, but analysts generally believe that this warning may indicate a more hardline U.S. policy toward Latin American affairs. This statement triggered a strong backlash from the Venezuelan government. A spokesperson for the Venezuelan Ministry of Foreign Affairs stated that Venezuela will firmly safeguard its national sovereignty and will not accept external interference. This concludes our report. Please stay tuned for further updates.\n- **References**:\n  - [1] KSAT (Associated Press):",
  "title": "Latest global political and military news",
  "summary": "Welcome to the Daily News Channel, I'm Joe. In the past 24 hours, the global security landscape has once again become volatile: Europe, while strengthening its satellite communications and defense autonomy, faces subtle shifts in the relationship between NATO and the United States; the United States has conducted military exercises and operations in the Middle East and Latin America, while simultaneously reducing humanitarian aid to the United Nations; in Asia, India and the European Union have deepened their economic and security cooperation, and India and Russia plan joint naval exercises in the Bay of Bengal; and in the Arctic, the dispute over Greenland has reignited geopolitical tensions. In addition, the Russia-Ukraine conflict, the Syrian war, and terrorist attacks continue. Today, we will quickly summarize the background and context of these important events.",
  "coverImage": "https://picsum.photos/seed/2026-1-28/800/600",
  "audioUrl": "https://storage.dailyintel.qzz.io/en/audio_2026-1-28-en.mp3"
}
